"sigla_evento";"nome_evento";"estrato"
E-Learning;IADIS International Conference on e-Learning;B3
EA;International Conference on Artificial Evolution;B3
EACL;Conference of the European Chapter of the Association for Computational Linguistics;A1
EAIS;IEEE Conference on Evolving and Adaptive Intelligent Systems;B2
EANN;Internation Conference on Engineering Applications of Neural Networks;B2
EASE;International Conference on Evaluation and Assessment in Software Engineering;A3
EATIS;Euro American Conference on Telematics and Information Systems;B3
EC;ACM conference on Economics and Computation;A1
EC-TEL;EC-TEL - European Conference on Technology Enhanced Learning;A3
ECAI;European Conference on Artificial Intelligence;A3
ECAL;European Conference on Artificial Life;B1
ECC;European Control Conference;A2
ECCE;European Conference on Cognitive Ergonomics;B3
ECCTD;European Conference on Circuit Theory and Design;B2
ECCV;European Conference on Computer Vision;A1
ECCWS;European Conference on Cyber Warfare and Security;B3
ECIR;European Conference on Information Retrieval;A2
ECIS;European Conference on Information Systems;A2
ECMDAFA;European Conference on Modelling Foundations and Applications;B1
FUZZIEEE;IEEE International Conference on Fuzzy Systems;A3
ECML;European Conference on Machine Learning and Principles and Practice of Knowledge Discovery in Databases;A2
ECMR;European Conference on Mobile Robots;A3
ECMS;European Conference on Modelling and Simulation;B1
ECOOP;European Conference on Object-Oriented Programming;A3
ECRTS;Euromicro Conference on Real-Time Systems;A2
ECSA;European Conference on Software Architecture;A4
ECSAW;European Conference on Software Architecture Workshops;B2
ECSQARU;European Conference on Symbolic and Quantitative Approaches to Reasoning and Uncertainty;B1
ECTA;International Conference on Evolutionary Computation Theory and Applications;B4
ECTEL;European Conference on Technology Enhanced Learning;A4
ECWeb;International Conference on Electronic Commerce and Web Technologies;B2
EDBT;International Conference on Extending Database Technology;A2
EDCC;European Dependable Computing Conference;B1
EDM;International Conference on Educational Data Mining;A2
EDOC;IEEE International Enterprise Distributed Object Computing Conference;A3
EEEWC;International Conference on e-Learning, e-Business, Enterprise Information Systems, and e-Government;B4
EGOV;International Conference on Electronic Government;A4
EGOV-CEDEM-EPART;International Conference on Electronic Government/International Conference for E-Democracy and Open Government;A4
EGOVIS;International Conference on Electronic Government and the Information Systems Perspective;B1
EICS;ACM SIGCHI Symposium on Engineering Interactive Computing Systems;A3
EIDWT;International Conference on Emerging Intelligent Data and Web Technologies;B2
EIS;SPIE Human Vision and Electronic Imaging;B1
eKNOW;IARIA International Conference on Information, Process, and Knowledge Management;B4
ELECAI;Electronics, Computers and Artificial Intelligence;B2
EM-GIS;International Workshop on the Use of GIS in Emergency Management;B4
EMAS;International Workshop on Engineering Multiagent Systems;B4
EMBC;Annual International Conference of the IEEE Engineering in Medicine and Biology Society;A2
EMBS;IEEE-EMBS International Conference on Biomedical and Health Informatics;A3
EMNLP;Conference on Empirical Methods in Natural Language Processing;A1
EMO;International Conference on Evolutionary Multi-Criterion Optimization;A4
EMSOFT;ACM International Conference on Embedded Software;A3
ENANPAD;Encontro Nacional da Associação Nacional de Pós-Graduação e Pesquisa em Administração;B2
ENASE;International Conference on Evaluation of Novel Approaches to Software Engineering;B2
ENERGY-IARIA;IARIA International Conference on Smart Grids, Green Communications and IT Energy-aware Technologies;B4
ENIAC;Encontro Nacional de Inteligencia Artificial e Computacional;B4
ENIC;European Network Intelligence Conference;B3
EPIA;Portuguese Conference on Artificial Intelligence;B2
ER;International Conference on Conceptual Modeling;A3
ERLANG;ACM SIGPLAN Erlang Workshop;B3
ESA;European Symposium on Algorithms;A3
ESANN;European Symposium on Artificial Neural Networks, Computational Intelligence and Machine Learning;B1
ESCIENCE;cience - IEEE International Conference on e-Science;A3
ESEC/FSE;Joint Meeting on European Software Engineering Conference and Foundations of Software Engineering;A1
ESELAW;Workshop Latinoamericano de Ingeniería de Software Experimental;B4
ESEM;ACM/IEEE International Symposium on Empirical Software Engineering and Measurement;A3
ESOCC;EUROPEAN CONFERENCE ON SERVICE-ORIENTED AND CLOUD COMPUTING;A4
ESOP;European Symposium on Programming;A2
ESORICS;European Symposium on Research in Computer Security;A2
ESSCIRC;European Solid State Circuits Conference;A3
ESSDERC;European Solid State Device Research Conference;B1
ESWC;Extended Semantic Web Conference;A2
ESWS;European Semantic Web Conference;A2
ETELEMED-IARIA;IARIA International Conference on eHealth, Telemedicine, and Social Medicine;B4
ETFA;IEEE International Conference on Emerging Technologies and Factory Automation;A3
ETRA;Biennial ACM Symposium on Eye Tracking Research & Applications;A4
ETS;IEEE European Test Symposium;B1
EUC;IEEE/IFIP International Conferences on Embedded and Ubiquitous Computing;B4
EuCNC;European Conference on Networks and Communications;A4
EUMAS;European Conference on Multi-Agent Systems;B3
EURO;European Conference on Operational Research;B4
EUROCG;European Workshop on Computational Geometry;B4
EUROCOMB;European Conference on Combinatorics, Graph Theory and Applications;A3
EUROCRYPT;International Conference on Theory and Applications of Cryptographic Techniques;A1
EuroGP;European Conference on Genetic Programming;A4
EUROGRAPHICS;European Association for Computer Graphics;A1
EUROHAPTICS;Eurohaptics;A3
EUROITV;European Conference on Interactive TV and Video;B2
EUROMICRO;Euromicro Conference on Software Engineering and Advanced Applications;A4
EuroMPI;European MPI Users Group Meeting;B1
EUROPAR;European Conference on Parallel Computing;A3
EuroParW;Parallel Processing Workshops;B2
EUROPKI;European Public Key Infrastructure Workshop;B4
EuroPloP;European Conference on Pattern Languages of Programs;B2
EUROSIM;Congress on Modelling and Simulation;B3
EuroSPI;European Conference on Software Process Improvement;B2
EUROSYS;European Conference on Computer Systems;A1
EuroVis;EG/VGTC Conference on Visualization;A1
EuroVISW;EuroVis Workshop on Visual Analytics (EuroVA);B4
EUSFLAT;Conference of the European Society for Fuzzy Logic and Technology;B2
EUSIPCO;European Signal Processing Conference;A3
EUVIP;European Workshop on Visual Information Processing;B2
EVA;Electronic Visualisation and the Arts;B3
EVOAPPLICATIONS;European Conference on the Applications of Evolutionary Computation;A4
EVOCOP;European Conference on Evolutionary Computation in Combinatorial Optimization;B1
EWC;EMBEDDED WORLD CONFERENCE;B3
EWSDN;European Workshop on Software Defined Networks;A4
EWSN;European Conference on Wireless Sensor Networks;B1
EXAMPI;Workshop on Exascale MPI;B3
EXP.AT;Experiment@ International Conference;B2
FACS;International Conference on Formal Aspects of Component Software;B2
FASE;International Conference on Fundamental Approaches to Software Engineering;A3
FAST;USENIX Conference on File and Storage Technologies;A1
FC;International Conference on Financial Cryptography and Data Security;A1
FCCM;IEEE Annual International Symposium on Field-Programmable Custom Computing Machines;A3
FCT;International Symposium on Fundamentals of Computation Theory;B2
FCTA;International Conference on Fuzzy Computation Theory and Applications;B4
FDG;Foundations of Digital Games;A3
FDL;Forum on Specification and Design Languages;B3
FECS-WS;International Conference on Frontiers in Education: Computer Science and Computer Engineering;B3
FEDCSIS;Federated Conference on Computer Science and Information Systems;A2
FG;Conference on Formal Grammar;B3
FGR;IEEE International Conference on Automatic Face and Gesture Recognition;A1
FiCloud;International Conference on Future Internet of Things and Cloud;A4
FIE;IEEE Frontiers in Education Conference;A3
FIT;INTERNATIONAL CONFERENCE ON FRONTIERS OF INFORMATION TECHNOLOGY;B2
FLAIRS;International Florida Artificial Intelligence Conference;A4
FM;International Symposium on Formal Methods;A3
FMCAD;International Conference on Formal Methods in Computer-Aided Design;A3
FOCI;IEEE Symposium on Foundations of Computational Intelligence;B2
FOCS;IEEE Annual Symposium on Foundations of Computer Science;A1
FOGA;ACM Conference on Foundations of Genetic Algorithms;B2
FoIKS;International Symposium on Foundations on Information and Knowledge Systems;B3
FOIS;International Conference on Formal Ontology in Information Systems;B4
ICPC;International Conference on Program Comprehension;A3
FORMATS;International Conference on Formal Modeling and Analysis of Timed Systems;B1
FOSD;International Workshop on Feature-Oriented Software Development;B3
FoSSaCS;International Conference on Foundations of Software Science and Computation Structures;A3
FPGA;Symposium on Field Programmable Gate Arrays;A2
FPL;International Conference on Field-Programmable Logic and Applications;A2
FROCOS;International Symposium on Frontiers of Combining Systems;B1
FSCD;International Conference on Formal Structures for Computation and Deduction;B2
FSE;Fast Software Encryption;A2
FSKD;International Conference on Fuzzy Systems and Knowledge Discovery;B2
FSTTCS;Annual Conference on Foundations of Software Technology and Theoretical Computer Science;B1
FTC;Future Technologies Conference;B1
FTXS;Workshop on Fault Tolerance for HPC at eXtreme Scale;B3
FUSION;International Conference on Information Fusion;A2
IBERCHIP;Workshop Iberchip;B4
GAMEON;Annual Simulation and AI in Games Conference;B4
GAS;International Workshop on Games and Software Engineering;B3
GCCE;IEEE Global Conference on Consumer Electronics;B1
GECCO;Genetic and Evolutionary Computation Conference;A2
GECON;International Conference on Economics of Grids, Clouds, Systems and Services;B3
GEM;IEEE Games, Entertainment, Media Conference;B1
GeoAI;International Workshop on AI for Geographic Knowledge Discovery;B4
GEOINFO;Brazilian Symposium on GeoInformatics;B1
GeoPrivacy;Workshop on Privacy in Geographic Information Collection and Analysis;B4
GeoPROCESSING-IARIA;IARIA International Conference on Advanced Geographic Information Systems, Applications, and Services;B4
GeoSim;International Workshop on Geospatial Simulation;B4
GI;Graphics Interface Conference;A4
GIIS;Global Information Infrastructure and Networking Symposium;B2
GIOTS;GLOBAL INTERNET OF THINGS SUMMIT;B2
GIR;Workshop on Geographic Information Retrieval;B1
GIS;ACM SIGSPATIAL International Conference on Advances in Geographic Information Systems;A2
GIScience;International Conference on Geographic Information Science;A3
GLOBALDEV;Workshop of the AIS Special Interest Group for ICT in Global Development;B4
GLOBALSIP;Global Conference on Signal and Information Processing;A2
GLOBECOM;IEEE Global Communications Conference;A1
GLSVLSI;Great Lakes Symposium on VLSI;A4
GLVLSI;ACM Great Lakes Symposium on VLSI;A4
GPC;International Conference on Grid And Pervasive Computing;B2
GPCE;ACM International Conference on Generative Programming: Concepts and Experiences;B4
GraphQ;International Workshop on Querying Graph Structured Data (EDBT);B4
GRAPP;International Conference on Computer Graphics Theory and Applications;B2
GreenCom;IEEE International Conference on Green Computing and Communications;B2
GREENS;International Workshop on Green and Sustainable Software;B1
GROUP;International Conference on Supporting Group Work;A4
GVIZ;Workshop on New Directions in Geovisual Analytics;B4
HAIS;International Conference on Hybrid Artificial Intelligence Systems;B2
HAPTICS;IEEE Haptics Symposium;A3
HASE;IEEE International Symposium on High Assurance Systems Engineering;A4
HCI;International Conference on Human-Computer Interaction;B1
HCI3P;Workshop on Human Computer Interaction in Third Places;B4
HCIST;International Conference on Health and Social Care Information Systems and Technologies;B4
HCOMP;Conference on Human Computation and Crowdsourcing;A3
HCSE;International Working Conference on Human-Centred Software Engineering;B4
HEALTHCOM;IEEE International Conference on E-health Networking, Application & Services;A3
HEALTHINF;International Conference on Health Informatics;A3
HICSS;Hawaii International Conference on System Sciences;A1
HIPC;IEEE International Conference on High Performance Computing;A3
HIS;International Conference on Hybrid Intelligent Systems;B2
HM;International Workshop on Hybrid Metaheuristics;B2
HOST;IEEE International Symposium on Hardware Oriented Security and Trust;A2
HOTNETS;ACM Workshop on Hot Topics in Networks;A2
HPCA;IEEE International Symposium on High Performance Computer Architecture;A1
HPCC;International Conference on High Performance Computing and Communications;A3
HPCS;International Conference on High Performance Computing & Simulation;A4
HPDC;International Symposium on High Performance Distributed Computing;A2
HPG;High-Performance Graphics;B1
HPPN;Workshop on High Performance and Programmable Networking;B3
HPSR;IEEE High Performance Switching and Routing;B1
HR;Workshop on Hybrid Reasoning;B4
HRI;ACM/IEEE International Conference on Human Robot Interaction;A1
HT;ACM Conference on Hypertext and Social Media;A3
Humanoids;IEEE RAS International Conference on Humanoid Robot;A2
HVC;International Haifa Verification Conference;B4
Hypertext;ACM Conference on Hypertext and Hypermedia;A3
I2MTC;IEEE International Instrumentation and Measurement Technology Conference;A4
IAAI;International Conference of the Italian Association for Artificial Intelligence;B4
IAS;Industry Applications Society Annual Meeting;A3
IAT;IEEE/WIC/ACM International Conference on Intelligent Agent Technology;A4
IAV;IFAC Symposium on Intelligent Autonomous Vehicles;B4
IBERAMIA;Ibero-American Conference on Artificial Intelligence;B3
IbPRIA;Iberian Conference on Pattern Recognition and Image Analysis;B2
IC2E;IEEE International Conference on Cloud Engineering;A3
IC3K;International Joint Conference on Knowledge Discovery, Knowledge Engineering and Knowledge Management;B3
ICA3PP;International Conference on Algorithms and Architectures for Parallel Processing;B1
ICAART;International Conference on Agents and Artificial Intelligence;B1
ICAC;International Conference on Autonomic Computing;A3
ICAIS;International Conference on Adaptive and Intelligent Systems;B3
ICAISC;International Conference on Artificial Intelligence and Soft Computing;A3
ICAIWC;International Conference on Artificial Intelligence;B3
ICALP;International Colloquium on Automata, Languages, and Programming;A2
ICALT;IEEE International Conference on Advanced Learning Technologies;A3
ICANN;International Conference on Artificial Neural Networks;B1
ICAPS;International Conference on Automated Planning and Scheduling;A2
ICAR;International Conference on Advanced Robotics;A3
ICARCV;International Conference on Control, Automation, Robotics and Vision;B2
ICARM;International Conference on Advanced Robotics and Mechatronics;B3
ICAROB;International Conference on Artificial Life and Robotics;B4
ICARSC;IEEE International Conference on Autonomous Robot Systems and Competitions;B1
ICARV;International Conference on Control, Automation, Robotics and Vision;B2
ICAS-IARIA;IARIA International Conference on Autonomic and Autonomous Systems;B3
ICASSP;IEEE International Conference on Acoustics, Speech and Signal Processing;A1
ICAT;International Conference on Artificial Reality and Telexistence;B2
ICB;International Conference on Biometrics;A3
ICC;IEEE International Conference on Communications;A1
ICCA;IEEE International Conference on Control and Automation;A4
ICCABS;International Conference on Computational Advances in Bio and Medical Sciences;B2
ICCAD;IEEE/ACM International Conference on ComputerAided Design;A2
ICCAR;International Conference on Control, Automation and Robotics;B2
ICCC;International Conference on Computational Creativity;A4
ICCCC;International Conference on Computers Communications and Control;B3
ICCCN;International Conference on Computer Communications and Networks;B2
ICCD;International Conference on Computer Design;A3
ICCDCS;International Caribbean Conference on Devices, Circuits and Systems;B4
ICCE;IEEE International Conference on Consumer Electronics;B1
ICCE-EDU;International Conference on Computers in Education;B2
ICCEBerlin;IEEE International Conference on Consumer Electronics Berlin;B1
ICCETaiwan;IEEE International Conference on Consumer Electronics Taiwan;B2
ICCHP;International Conference on Computers Helping People with Special Needs;B1
ICCIC;International Conference on Computational Intelligence and Computing Research;A4
ICCL2;International Conference on Computational Logistics;B2
ICCNC;International Conference on Computing, Networking and Communications;A2
ICCP;IEEE International Conference on Intelligent Computer Communication and Processing;B1
ICCPS;International Conference on Cyber-Physical Systems;A2
ICCRTS;International Command and Control Research and Technology Symposium;B4
ICCS;International Conference on Computational Science;B2
ICCSA;International Conference on Computational Science and Its Applications;A3
ICCV;IEEE International Conference on Computer Vision;A1
ICCVE;International Conference on Connected Vehicles & Exp;A4
ICCVW;IEEE International Conference on Computer Vision Workshops;A3
ICCW;IEEE International Conference on Communications Workshops;B3
ICDAR;International Conference on Document Analysis and Recognition;A2
ICDCN;International Conference on Distributed Computing and Networking;A3
ICDCS;International Conference on Distributed Computing Systems;A1
ICDCSW;International Conference on Distributed Computing Systems Workshops;A4
ICDE;IEEE International Conference on Data Engineering;A1
ICDF;IFIP International Conference on Digital Forensics;B3
ICDIM;International Conference on Digital Information Management;B2
ICDIP;International Conference on Digital Image Processing;A4
ICDM;IEEE International Conference on Data Mining;A1
ICDMW;IEEE International Conference on Data Mining Workshop (ICDMW);A1
ICDP;International Conference on Imaging for Crime Detection and Prevention;B4
ICDS-IARIA;IARIA International Conference on Digital Society;B4
ICDSP;IEEE International Conference on Digital Signal Processing;A4
ICDT;International Conference on Database Theory;A3
ICE-CCN;International Conference on Emerging Trends in Computing, Communication and Nanotechnology;B1
ICEBE;IEEE International Conference on e-Business Engineering;B2
ICEC;IFIP International Conference on Entertainment Computing;A3
ICECCS;International Conference on Engineering of Complex Computer;B2
ICECS;IEEE International Conference on Electronics, Circuits and Systems;B1
ICED;International Conference on Engineering Design;B1
ICEGOV;International Conference on Theory and Practice of Eletronic Governance;B1
ICEIS;International Conference on Enterprise Information Systems;A3
ICER;International Computing Education Research;A3
ICERI;International Conference of Education, Research and Innovation;B3
ICFEM;International Conference on Formal Engineering Methods;A4
ICFHR;International Conference on Frontiers in Handwriting Recognition;A4
ICFP;International Conference on Functional Programming;A2
ICGJ;International Conference on Game Jams, Hackathons, and Game Creation Events;B3
ICGSE;IEEE International Conference on Global Software Engineering;B1
ICGT;International Conference on Graph Transformations;B3
ICGTT;International Conference on Graph Transformation;B1
ICHI;IEEE International Conference on Healthcare Informatics;A3
ICHQP;IEEE International Conference on Harmonics and Power Quality;B1
ICIAP;International Conference on Image Analysis and Processing;A3
ICIAR;International Conference on Image Analysis and Recognition;B1
ICIC;International Conference on Intelligent Computing;B2
ICICS;International Conference on Information and Communications Security;B2
ICIDS;International Conference on Interactive Digital Storytelling;A3
ICIEOM;International Conference on Industrial Engineering and Operations Management;B2
ICIG;International Conference on Image and Graphics;B2
ICIIECS;International Conference on Innovations in Information, Embedded and Communication Systems;B2
ICINCO;International Conference on Informatics in Control, Automation and Robotics;A4
ICIOT;International Conference on the Internet of Things;A4
ICIP;IEEE International Conference on Image Processing;A1
ICIQ;International Conference on Information Quality;B2
ICIS;International Conference on Information Systems;A2
ICISC;International Conference on Information Security and Cryptology;B1
ICISO;International Conference on Informatics and Semiotics in Organisations;B3
ICISS;International Conference on Information Systems Security;B2
ICISSP;International Conference on Information Systems Security and Privacy;B2
ICIST;International Conference on Information and Software Technologies;B2
ICIT;IEEE International Conference on Industrial Technology;A3
ICITS;International Conference on Information Theoretic Security;B2
ICITST;International Conference for Internet Technology and Secured Transactions;B1
ICIV;International Conference on Information Visualisation;B1
ICIVC;International Conference on Image, Vision and Computing;B4
ICIW-IARIA;IARIA International Conference on Internet and Web Applications and Services;B4
ICL;International Conference on Interactive Collaborative Learning;B3
ICLA;Indian Conference on Logic and its Applications;B2
ICLP;International Conference on Logic Programming;A3
ICLR;International Conference on Learning Representations;A1
ICM;International Conference on Microelectronics;B2
ICMA;IEEE International Conference on Mechatronics and Automation;A4
ICMC;International Computer Music Conference;A3
ICMCR;International Conference on Mechatronics, Control and Robotics;B4
ICMCS;IEEE International Conference on Multimedia Computing and Systems;B1
ICME;IEEE International Conference on Multimedia and Expo;A2
ICMEW;IEEE International Conference on Multimedia and Expo Workshops;A3
ICMI;ACM International Conference on Multimodal Interfaces;A2
ICML;International Conference on Machine Learning;A1
ICMLA;IEEE International Conference on Machine Learning and Applications;A3
ICMPC;International Conference on Music Perception and Cognition;B3
ICMR;ACM International Conference on Multimedia Retrieval;A2
ICN;ACM International Conference on Information-Centric Networking;A2
ICN-IARIA;IARIA International Conference on Networks;B4
ICNC;International Conference on Natural Computation;A4
ICNC-FSKD;International Conference on Natural Computation, Fuzzy Systems and Knowledge Discovery;B2
ICNP;International Conference on Network Protocols;A2
ICNS-IARIA;IARIA International Conference on Networking and Services;B4
ICNSC;IEEE International Conference on Networking, Sensing and Control;A4
ICOIN;International Conference on Information Networking;A3
ICOMPWC;International Conference on Internet Computing and Internet of Things;B2
ICONIP;International Conference on Neural Information Processing;A4
ICONS-IARIA;IARIA International Conference on Systems;B3
ICORES;International Conference on Operations Research and Enterprise Systems;B4
ICORR;IEEE International Conference on Rehabilitation Robotics;A3
ICPADS;International Conference on Parallel and Distributed Systems;B1
ICPE;International Conference on Performance Engineering;A3
ICPME;International Conference on Philosophy, Music and Emotion;B4
ICPP;International Conference on Parallel Processing;A3
ICPR;International Conference on Pattern Recognition;A2
ICRA;IEEE International Conference on Robotics and Automation;A1
ICRAE;International Conference on Robotics and Automation Engineering;B4
ICS;International Conference on Supercomputing;A2
ICSA;Working IEEE/IFIP Conference on Software Architecture;A4
ICSC;International Conference on Semantic Computing;A3
ICSE;International Conference on Software Engineering;A1
ICSEA-IARIA;IARIA International Conference on Software Engineering Advances;B4
ICSEW;International Conference on Software Engineering Workshops;B3
ICSI;International Conference on Swarm Intelligence;A4
ICSLE;International Conference on Smart Learning Environments;B3
ICSME;IEEE International Conference on Software Maintenance and Evolution;A2
ICSNC-IARIA;IARIA International Conference on Systems and Networks Communications;B4
ICSOB;International Conference on Software Business;B1
ICSOC;International Conference on Service Oriented Computing;A3
ICSOFT;International Conference on Software Technologies;B2
ICSPCEC;International Conference on Signal Processing, Communication, Power and Embedded System;B3
ICSR;International Conference on Software Reuse;B1
ICST;International Conference on Sensing Technology;B2
ICSTV;IEEE International Conference on Software Testing, Verification and Validation;A2
ICT;International Conference on Telecommunications;A4
ICTAC;International Colloquium on Theoretical Aspects of Computing;B1
ICTAI;IEEE International Conference on Tools with Artificial Intelligence;A3
ICTCS;Italian Conference on Theoretical Computer Science;B4
ICTIR;Conference on the Theory of Information Retrieval;B1
ICTON;International Conference on Transparent Optical Networks;A4
ICTSS;IFIP International Conference on Testing Software and Systems;B2
ICUAS;International Conference on Unmanned Aircraft Systems;A2
ICUMT;International Conference on Ultra Modern Telecommunications;B1
ICVIIP;International Conference on Visualization: Imaging and Image Processing;B4
ICVR;International Conference on Virtual Rehabilitation;B1
ICVRV;International Conference on Virtual Reality and Visualization;B4
ICVS;International Conference on Computer Vision Systems;B1
ICWE;International Conference on Web Engineering;A3
