"sigla_evento";"nome_evento";"estrato"
IEEE VIS;IEEE Visualization;A1
VTS;IEEE VLSI Test Symposium;A4
"21CW";IEEE Conference on Norbert Wiener in the 21st Century;B2
"3DCVE";International Workshop on Collaborative Virtual Environments;B3
"3DIC";International 3D System Integration Conference;B1
"3DIPM";Three-Dimensional Image Processing, Measurement and Applications;B3
"3DOR";Eurographics Workshop on 3D Object Retrieval;B2
"3DTV";"3DTV Conference: The True Vision-Capture, Transmission and Display of 3D Video";B2
"3DUI";IEEE Symposium on 3D User Interfaces;A3
"3DV";International Conference on 3D Vision;A2
"3PGCIC";International Conference on P2P, Parallel, Grid, Cloud and Internet Computing;B1
A-TEST;EST - International Workshop on Automating Test Case Design, Selection and Evaluation;B4
AAAI;Conference on Artificial Intelligence;A1
AAATE;Association for the Advancement of Assistive Technology in Europe Congress;B4
AAMAS;International Conference on Autonomous Agents and Multiagent Systems;A1
ABCIBER;Congresso Brasileiro de Pesquisadores em Cibercultura;B4
ABZ;International ABZ Conference ASM, Alloy, B, TLA, VDM, Z;A4
AC-HCI;International Conference on Augmented Cognition;A4
ACC;American Control Conference;A1
ACCV;Asian Conference on Computer Vision;A2
ACE;International Conference on Advances in Computer Entertainment Technology;B1
ACE-X;International Conference on Advanced Computational Engineering and Experimenting;B4
ACHI-IARIA;IARIA International Conference on Advances in Computer-Human Interactions;B4
ACII;International Conference on Affective Computing and Intelligent Interaction;A3
ACIRS;Asia-Pacific Conference on Intelligent Robot Systems;B4
ACISP;Australasian Conference on Information Security and Privacy;A4
ACIVS;Advanced Concepts for Intelligent Vision Systems;B2
ACL;Annual Meeting of the Association for Computational Linguistics;A1
ACM CC;Creativity & Cognition;B1
ACM CCS;ACM Symposium on Computer and Communications Security;A1
ACM CHI PLAY;Annual Symposium on Computer-Human Interaction in Play;A3
ACM DocEng;ACM Symposium on Document Engineering;B1
ACM SIGSPATIAL;ACM International Conference on Advances in Geographic Information Systems;A2
ACM TVX;International Conference on Experiences for TV and Online Video;A3
ACMIDC;ACM Interaction Design and Children;A2
ACMMM;ACM International Conference on Multimedia;A1
ACMSOCC;ACM Symposium on Cloud Computing;A1
ACNS;Applied Cryptography and Network Security;A3
ACRA;Australasian Conference on Robotics and Automation;B3
ACRI;International conference on Cellular Automata for Research and Industry;B3
ACSAC;Computer Security Applications Conference;A2
ADBIS;East European Conference on Advances in Databases and Information Systems;A4
ADHOC-NOW;OW - International Conference on Ad-Hoc Networks and Wireless;B2
ADVANCE;International Workshop on ADVANCEs in ICT Infrastructures and Services;B4
ADVCOMP-IARIA;IARIA International Conference on Advanced Engineering Computing and Applications in Sciences;B4
AES;International Convention of the Audio Engineering Society;B3
AES Brasil;Congresso de Engenharia de Áudio da Audio Engineering Society Brasil.;B4
AES-ICSA;AES International Conference on Semantic Audio;B2
AGERE;Workshop on Programming based on Actors, Agents, and Decentralized Control;B3
AGI;Conference on Artificial General Intelligence;B2
AGILE;Agile Conference;A3
AGILEGIS;Conference on Geographic Information Science;B3
AH;Augmented Human International Conference;A3
AHS;NASA/ESA Conference on Adaptive Hardware and Systems;B2
AI;Canadian Conference on Artificial Intelligence;B2
AICCSA;ACS/IEEE International Conference on Computer Systems and Applications;B2
AICT;International Conference on Application of Information and Communication Technologies;B3
AICT-IARIA;IARIA Advanced International Conference on Telecommunications;B4
AIED;Intternational Conference on Artificial Intelligence in Education;A3
AIIDE;AAAI Conference on Artificial Intelligence and Interactive Digital Entertainment;A3
AIM;IEEE/ASME International Conference on Advanced Intelligent Mechatronics;A4
AIME;Conference on Artificial Intelligence in Medicine;A4
AIML;Advances in Modal Logic;B3
AIMS;International Conference on Autonomous Infrastructure, Management and Security;B2
AINA;IEEE International Conference on Advanced Information Networking and Applications;A2
AINAW;IEEE International Conference on Advanced Information Networking and Applications Workshops;A2
AIPR;Applied Imagery Pattern Recognition Workshop;B2
AISEC;ACM Workshop on Artificial Intelligence and Security;A4
AISTATS;International Conference on Artificial Intelligence and Statistics;A1
AlCoB;International Conference on Algorithms for Computational Biology;B1
ALIO/EURO;Workshop on Applied Combinatorial Optimization;B4
ALLERTON;Allerton Conference on Communication, Control, and Computing;A2
AM;Audio Mostly on Interaction With Sound;B3
AMCIS;Americas Conference on Information Systems;A3
AMD;Workshop on Analysis of Movement Data;B4
AMIA;Annual Symposium of the American Medical Informatics Association;A3
AMW;Alberto Mendelzon International Workshop on Foundations of Data Management;B2
ANCS;ACM/IEEE Symposium on Architectures for Networking and Communications Systems;A4
ANPPOM;Congresso da Associação Nacional de Pesquisa e Pós-Graduação em Música;B3
ANTS;IEEE International Conference on Advanced Networks and Telecommuncations Systems;B1
AOFA;International Conference on Probabilistic, Combinatorial and Asymptotic Methods for the Analysis of Algorithms;B4
APCASE;Asia-Pacific Conference on Computer Aided System Engineering;B3
APCCAS;IEEE Asia Pacific Conference on Circuits and Systems;B3
APLAS;Asian Symposium on Programming Languages and Systems;B1
APNOMS;Asia-Pacific Network Operations and Management Symposium;B1
APPROX-RANDOM;APPROX-RANDOM;A3
APWEB;Asia-Pacific Web Conference;B3
ARC;International Symposium on Applied Reconfigurable Computing;B2
ARCS;International Conference on Architecture of Computing Systems;B1
ARES;International Conference on Availability, Reliability and Security;A4
ARGMAS;International Workshop on Argumentation in Multiagent Systems;B4
ARIC;International Workshop on Intelligent and Resilient Cities;B4
ARM;Workshop on Adaptive and Reflective Middleware;B3
ARMS-CC;International Workshop on Adaptive Resource Management and Scheduling for Cloud Computing;B3
ARSO;IEEE Workshop on Advanced Robotics and its Social Impacts (ARSO);B2
ARVO;Association for Research in Vision and Ophthalmology Annual Meeting;B4
ASAP;IEEE International Conference on Application-specific Systems, Architectures and Processors;A4
ASE;IEEE/ACM International Conference on Automated Software Engineering;A1
ASIACCS;ACM ASIA Symposium on Information, Computer and Communications Security;A1
ASIACRYPT;Annual International Conference on the Theory and Applications of Cryptology and Information Security;A1
ASIACSS;ACM on Asia Conference on Computer and Communications Security;A1
ASID;International Conference on Anti-counterfeiting, Security, and Identification in Communication;B4
ASMS;Advanced Satellite Multimedia Systems Conference;B1
ASONAM;IEEE/ACM International Conference on Advances in Social Networks Analysis and Mining;A2
ASP-DAC;Asia and South Pacific Design Automation Conference;A2
ASPLOS;International Conference on Architectural Support for Programming Languages and Operating Systems;A1
ASPRS;Annual Conference and International Lidar Mapping Forum;B4
ASSETS;International ACM SIGACCESS Conference on Computers and Accessibility;A3
AST;IEEE/ACM International Workshop on Automation of Software Testing;B4
ASYNC;IEEE International Symposium on Asynchronous Circuits and Systems;B1
ATT;International Workshop on Agents in Traffic and Transportation;B4
ATVA;International Symposium on Automated Technology for Verification and Analysis;A4
AUDIOMOSTLY;Audio Mostly Conference;B2
AVI;International Working Conference on Advanced Visual Interfaces;B1
AVSS;IEEE International Conference on Advanced Video and Signal Based Surveillance;A3
BCB;ACM International Conference on Bioinformatics and Computational Biology and Health Informatics;A4
BCS-HCI;Conference of the British Computer Society Human Computer Interaction Specialist Group;B1
BDCLOUD;International Conference on Big Data and Cloud Computing;B1
BEDS;ACM International Conference on Distributed Event-Based Systems;A3
BIATA;Bioinformatics: from Algorithms to Applications;B3
BIBE;IEEE International Conference on BioInformatics and BioEngineering;A3
BIBM;IEEE International Conference on Bioinformatics and Biomedicine;A3
BIGDATA;IEEE International Congress on BigData;A2
BIGDATASECURITY;IEEE International Conference on Big Data Security on Cloud;B2
BIGDATASERVICE;IEEE International Conference on Big Data Computing Service and Applications;B1
BIGDSE;IEEE/ACM International Workshop on Big Data Software Engineering;B2
BIGDSSAGRO;International Conference on Agro BigData and Decision Support Systems in Agriculture;B4
BIGMM;IEEE International Conference on Multimedia Big Data;B2
BigSpatial;ACM SIGSPATIAL International Workshop on Analytics for Big Geospatial Data;B2
BIH;International Conference on Brain Informatics and Health;B2
BioCOMP-WC;International Conference on Bioinformatics & Computational Biology;B3
BioRob;IEEE RAS & EMBS International Conference on Biomedical Robotics and Biomechatronics;A3
BIOSENSORS;World Congress on Biosensors;B4
BIOSIG;International Conference of the Biometrics Special Interest Group;B1
BIR;International Conferences on Perspectives in Business Informatics Research;B2
BMAW;Bayesian Modeling Applications Workshop;B4
BMEI;International Conference BioMedical Engineering and Informatics;B2
BMSB;IEEE International Symposium on Broadband Multimedia Systems and Broadcasting;B1
BMVC;British Machine Vision Conference;A1
BNAIC;Benelux Conference on Artificial Intelligence;B4
NFM;NASA Formal Methods Symposium;A3
BPM;International Conference on Business Process Management;A2
BPMS2;Workshop on Social and Human Aspects of Business Process Management;B4
BRACIS;Brazilian Conference on Intelligent System;A4
BRAHUR;Brazilian Humanoid Robot Workshop;B4
BRASERO;Brazilian Workshop on Service Robotics;B4
BraSNAM;Brazilian Workshop on Social Network Analysis and Mining;B3
BRC;ISSNIP Biosignals and Biorobotics Conference;B2
BRESCI;Brazilian e-Science Workshop;B4
BSB;Brazilian Symposium on Bioinformatics;B1
BSN;IEEE-EMBS INTERNATIONAL CONFERENCE ON WEARABLE AND IMPLANTABLE BODY SENSOR NETWORKS;A3
BTAS;IEEE International Conference on Biometrics: Theory, Applications, and Systems;A3
C4BIE;International Workshop on Cloud for Business, Industry and Enterprises;B4
CAAD;Computer-Aided Architectural Design Futures Conference;B3
CAD;International CAD Conference;B2
CADE;International Conference on Automated Deduction;A3
CADGRAPHICS;International Conference on Computer-Aided Design and Computer Graphics;B3
CAIP;International Conference on Computer Analysis of Images and Patterns;A4
CAISE;International Conference on Advanced Information Systems Engineering;A3
CAiSE-Forum;CAiSE Forum;B3
CAMAD;IEEE International Workshop on Computer Aided Modeling and Design of Communication Links and Networks;B1
CANDAR;International Symposium on Computing and Networking;B3
CANS;International Conference on Cryptology and Network Security;A3
CARE;Workshop on Collaborative Agents Research and Development;B4
CARLA;Latin American High Performance Computing Conference;SQ
CASA;Conference on Computer Animation and Social Agents;B3
CASCON;Annual International Conference on Computer Science and Software Engineering;B1
CASE;IEEE Conference on Automation Science and Engineering;A3
CASES;International Conference on Compilers, Architecture, and Synthesis for Embedded Systems;A4
CATA;International Conference on Computers and their Applications;B4
CATE;Computers and Advanced Technology in Education;B4
CAV;International Conference on Computer Aided Verification;A1
CBA;Congresso Brasileiro de Automática;B4
CBEB;Congresso Brasileiro de Engenharia Biomédica;B4
CBI;IEEE Conference on Business Informatics;A4
CBIS;Congresso Brasileiro de Informática em Saúde;B4
CBMI;International Workshop on Content-Based Multimedia Indexing;B1
CBMS;International Symposium on Computer-Based Medical Systems;A3
CBS;IEEE International Conference on Cyborg and Bionic Systems;B4
CBSE;International ACM Sigsoft Symposium on Component-Based Software Engineering;B1
CBSF;Congresso Brasileiro de Sistemas Fuzzy;B4
CBTMS;Congresso Brasileiro de Telemedicina e Telesaúde;B4
CC;International Conference on Compiler Construction;A4
CCC;IEEE Conference on Computational Complexity;A3
CCCG;Canadian Conference on Computational Geometry;B2
CCECE;Canadian Conference on Electrical and Computer Engineering;A4
CCGRID;IEEE/ACM International Symposium on Cluster, Cloud and Grid Computing;A2
CCIS;Conference of Computational Interdisciplinary Science;B4
CCNC;Annual IEEE Consumer Communications & Networking Conference;A3
CCS;ACM Symposium on Computer and Communications Security;A1
CCSI;Workshop on Core Computations on Spatial Information;B4
CDC;IEEE Conference on Decision and Control;A1
CDH;International Conference on Digital Health;B1
CDVE;International Conference on Cooperative Design, Visualization, and Engineering;B1
CEC;IEEE Congress on Evolutionary Computation;A1
CEDEM;International Conference for E-Democracy and Open Government;B4
CELDA;Cognition and Exploratory Learning in Digital Age;B4
CENTERIS;Conference on ENTERprise Information Systems;A4
CF;ACM International Conference on Computing Frontiers;A4
CGC;International Conference on Cloud and Green Computing;A4
CGI;Computer Graphics International Conference;B3
CGIM;International Conference on Computer Graphics and Imaging;B3
CGO;International Symposium on Code Generation and Optimization;A2
CHASE;International Workshop on Cooperative and Human Aspects of Software Engineering;A4
CHES;Conference on Cryptographic Hardware and Embedded Systems;A1
CHI;ACM Conference on Human Factors in Computing Systems;A1
CHIIR;Conference on Human Information Interaction and Retrieval;B2
CHIPlay;ACM SIGCHI Annual Symposium on Computer-Human Interaction in Play;A3
CIARP;Iberoamerican Congress on Pattern Recognition;A4
CIBCB;IEEE Conference on Computational Intelligence in Bioinformatics and Computational Biology;A4
CIbSE;Conferencia Iberoamericana de Software Engineering;B2
CIC;International Conference on Collaboration and Internet Computing;B2
CICC;IEEE Custom Integrated Circuits Conference;A3
CICLING;International Conference on Intelligent Text Processing and Computational Linguistics;A3
CICOMMS;Symposium on Computational Intelligence for Communication Systems and Networks;B3
CICS;Symposium on Computational Intelligence in Cyber Security;B3
CIDI;Congresso Internacional de Design da Informação;B4
CIDM;Symposium on Computational Intelligence and Data Mining;B1
CIDR;Biennial Conference on Innovative Data Systems Research;A2
CiE;Computability in Europe;B1
CIG;IEEE Conference on Computational Intelligence and Games;A2
CIKM;ACM International Conference on Information and Knowledge Management;A1
CILAMCE;Iberian Latin American Congress on Computational Methods;B4
CIMENICS;International Congress on Numerical Methods in Engineering and Applied Sciences;B4
CIMSIVP;IEEE Symposium on Computational Intelligence for Multimedia, Signal and Vision Processing;B3
CISIS;International Conference on Complex, Intelligent, and Software Intensive Systems;A4
CISRC;Cyber Security and Information Intelligence Research Workshop;B2
CISTI;Iberian Conference on Information Systems and Technologies;A4
CIT;IEEE International Conference on Computer and Information Technology;B3
CITS;International Conference on Computer, Information, and Telecommunication Systems;B2
CIVTS;IEEE Symposium on Computational Intelligence in Vehicles and Transportation Systems;B2
CL;Corpus Linguistics Conference;B3
CL4LC;Workshop on Computational Linguistics for Linguistic Complexity;B4
CLEF;Conference and Labs of the Evaluation Forum;B3
CLEI;Conferencia Latinoamericana de Informática;B2
CLIHC;Latin American Conference on Human Computer Interaction;B3
CLOSER;International Conference on Cloud Computing and Services Science;A4
CloudCom;IEEE International Conference on Cloud Computing Technology and Science;A2
CLOUDCOMPUTING-IARIA;IARIA International Conference on Cloud Computing, GRIDs, and Virtualization;B3
CLOUDDB;IEEE International workshop on Cloud data management;B4
CloudNet;IEEE International Conference on Cloud Networking;A2
CLOUDTECH;International Conference on Cloud Computing Technologies and Applications;B3
CLUSTER;IEEE International Conference on Cluster Computing;A3
CMBBE;International Symposium on Computer Methods in Biomechanics and Biomedical Engineering - 29;B4
CMC;International Conference on Concept Mapping;B3
CMMR;International Symposium on Computer Music Multidisciplinary Research;A4
CMN;Congress on Numerical Methods in Engineering;B4
CMSB;International Conference on Computational Methods in Systems Biology;B1
CNMAC;Congresso Nacional de Matemática Aplicada e Computacional;B3
CNS;IEEE Conference on Communications and Network Security;A3
CNSM;International Conference on Network and Service Management;A3
CoARCH;Workshop On Computing Techniques For Spatio-Temporal Data in Archaeology And Cultural Heritage - 21;B4
CobRA;International Workshop on Exploring Component-based Techniques for Constructing Reference Architectures;B4
COCOA;International Conference on Combinatorial Optimization and Applications;B2
COCOON;International Computing and Combinatorics Conference;A4
CODASPY;ACM Conference on Data and Application Security and Privacy;A2
CODES+ISSS;International Conference on Hardware/Software Codesign and System Synthesis;A3
COG;IEEE Conference on Games;A3
COGNISE;International Workshop on Cognitive Aspects of Information Systems Engineering;B4
COGNITIVE-IARIA;IARIA International Conference on Advanced Cognitive Technologies and Applications;B3
COGSCI;Annual Meeting of the Cognitive Science Society;A2
CogSIMA;IEEE International Multi-Disciplinary Conference on Cognitive Methods in Situation Awareness and Decision Support;B2
COIN;International Workshop on Coordination, Organisations, Institutions and Norms;B4
COLING;International Conference on Computational Linguistics;A2
COLOGNETWENTE;Cologne-Twente Workshop on Graphs and Combinatorial Optimization;B3
COLT;Conference on Learning Theory;A1
COMMA;International Conference on Computational Models of Argument;A4
RSS;Robotics: Science and Systems;A1
COMMONSENSE;Symposium on Logical Formalizations of Commonsense Reasoning;B3
COMPGEOM;International Symposium on Computational Geometry;A3
COMPIMAGE;International Symposium CompIMAGE;B3
COMPLENET;INTERNATIONAL CONFERENCE ON COMPLEX NETWORKS;B4
COMPSAC;Annual International Computers, Software & Applications Conference;A3
CompSysTech;International Conference on Computer Systems and Technologies;B2
COMPUTEC;SEMINÁRIO DE COMPUTAÇÃO E MERCADO;B4
COMSNETS;International Conference on COMmunication Systems & NETworkS;A3
COMSOC;International Workshop on Computational Social Choice;B4
CONCUR;International Conference on Concurrency Theory;A3
CONEXT;Conference on Emerging Network Experiment and Technology;A2
CONFIRM;International Conference on Information Resources Management;B4
CoNLL;Conference on Natural Language Learning;A2
CONTECSI;International Conference on Information Systems and Technology Management;B3
CONTEXT-BPM;PM - International Workshop on Context for Business Process Management;B4
CoopIS;International Conference on Cooperative Information Systems;B2
COSIT;International Conference on Spatial Information Theory;A3
COSN;Conference on Online Social Networks;A3
COTB;Computer on The Beach;B3
COURB;Workshop of Urban Computing;B1
CP;International Conference on Principles and Practice of Constraint Programming;A3
CPA;Communicating Process Architectures;B3
CPM;Annual Symposium on Combinatorial Pattern Matching;A4
CPP;International Conference on Certified Programs and Proofs;B2
CRIWG;International Conference on Collaboration and Technology;B1
CRTL+E;Congresso sobre Tecnologias na Educação;B4
CRYPTO;International Cryptology Conference;A1
CSBIO;International Conference on Computational Systems-Biology and Bioinformatics;B3
CSC;SIAM Workshop on Combinatorial Scientific Computing;B3
CSCI;INTERNATIONAL CONFERENCE ON COMPUTATIONAL SCIENCE AND COMPUTATIONAL INTELLIGENCE;A4
CSCL;International Conference on Computer Supported Collaborative Learning;B2
CSCloud;International Conference on Cyber Security and Cloud Computing;A4
CSCN;IEEE Conference on Standards for Communications and Networking;B2
CSCW;ACM Conference on Computer Supported Cooperative Work & Social Computing;A1
CSCWC;International Conference on Scientific Computing;B3
CSCWD;IEEE International Conference on Computer Supported Cooperative Work in Design;A3
CSDS;Conference of the System Dynamics Society;B2
CSE;International Conference on Computational Science and Engineering;A4
CSEDU;International Conference on Computer Supported Education;A3
CSEE&T;Conference on Software Engineering Education and Training;A4
CSF;IEEE Computer Security Foundations Symposium;A3
CSI-SE;E - International Workshop on Crowdsourcing in Software Engineering;B2
CSL;Conference for Computer Science Logic;A3
CSMC;Conference on Computer Simulation of Musical Creativity;B3
CSMR;European Conference on Software Maintenance and Reengineering;A3
CSNDSP;International Symposium on Communication Systems, Networks and Digital Signal Processing;B1
CT-RSA;RSA Conference Cryptographers' Track;A2
CTE;International Conference on Computational Thinking Education;B4
CVPR;IEEE Conference on Computer Vision and Pattern Recognition;A1
CVPRW;IEEE Conference on Computer Vision and Pattern Recognition Workshops;A1
DAC;Design Automation Conference;A1
DAFX;International Conference on Digital Audio Effects;B1
DAIS;International Conference on Distributed Applications and Interoperable Systems;B1
DAMON;International Workshop on Data Management on New Hardware;A4
DARS;International Symposium on Distributed Autonomous Robotic Systems;B4
DAS;International Workshop on Document Analysis Systems;A4
DASFAA;International Conference on Database Systems for Advanced Applications;A3
DASIP;Conference on Design and Architectures for Signal and Image Processing;B2
DATAANALYTICS-IARIA;IARIA International Conference on Data Analytics;B4
DATE;Design, Automation and Test in Europe Conference and Exhibition;A1
DAWAK;International Conference on Big Data Analytics and Knowledge Discovery;B1
DBKD-AIARIA;IARIA International Conference on Advances in Databases, Knowledge, and Data Applications;B4
DBSec;IFIP WG 11.3 Conference on Data and Applications Security and Privacy;B1
DCAI;International Symposium on Distributed Computing and Artificial Intelligence;B2
DCASE;Workshop on Detection and Classification of Acoustic Scenes and Events;B4
DCC;Data Compression Conference;A3
DCCW;ACM Workshop on Distributed Cloud Computing;B3
DCM;International Workshop on Developments in Computational Models;B4
DCOSS;International Conference on Distributed Computing in Sensor Systems;A3
DDECS;IEEE International Symposium on Design and Diagnostics of Electronic Circuits and Systems;B2
DEA;International Conference on Data Envelopment Analysis;B4
DEBS;International Conference on Distributed and Event-Based Systems;A3
DEPCOS;ELCOMEX - International Conference on Dependability and Complex Systems;B2
DESAFIE;Workshop de Desafios da Computação Aplicada à Educação;B4
DESE;International Conference on Developments in eSystems Engineering;B3
DEXA;International Conference on Database and Expert Systems Applications;A4
DFT;IEEE International Symposium on Defect and Fault Tolerance in VLSI Systems;A4
DFTVS;IEEE International Symposium on Defect and Fault Tolerance of VLSI Systems;B1
DGCI;Discrete Geometry for Computer Imagery;B1
DGO;Annual International Conference on Digital Government Research;A4
DH;Digital Heritage;B1
DHM;International Conference on Digital Human Modeling - Applications in Health, Safety, Ergonomics and Risk Management;B2
DIGRA;Digital Games Research Association International Conference;B1
DILS;International Conference on Data Integration in Life Sciences;B3
DIS;Conference on Designing Interactive Systems;A2
DISC;International Symposium on Distributed Computing;A3
DIVANET;ACM Symposium on Development and Analysis of Intelligent Vehicular Networks and Applications;B2
DL;International Workshop on Description Logics;A3
DMA;International Conference on Data Mining and Applications;A4
DMNPL;Workshop on Interactions between Data Mining and Natural Language Processing;B4
DMS;International Conference on Distributed Multimedia Systems;B4
DOCENG;ACM SIGWEB International Symposium on Document Engineering;B1
DOLAP;International Workshop On Data Warehousing and OLAP;B2
DPM;International Workshop on Data Privacy Management;B4
DRCN;International Conference on the Design of Reliable Communication Networks;A4
DroNet;Workshop on Micro Aerial Vehicle Networks, Systems, and Applications for Civilian Use;B2
DS;International Conference on Discovery Science;B2
DS-RT;IEEE/ACM International Symposium on Distributed Simulation and Real-Time Applications;B2
DSAA;IEEE International Conference on Data Science and Advanced Analytics;B1
DSAI;International Conference on Software Development for Enhancing Accessibility and Fighting Info-exclusion;B2
DSC;IEEE Conference on Dependable and Secure Computing;B3
DSD;Euromicro Conference on Digital System Design;A3
DSN;Annual IEEE/IFIP International Conference on Dependable Systems and Networks;A2
DSNW;IEEE International Conference on Dependable Systems and Networks Workshops;B3
DSP;International Conference on Digital Signal Processing;A4
DSRT;IEEE/ACM International Symposium on Distributed Simulation and Real Time Applications;B2
DySPAN;IEEE Symposium on New Frontiers in Dynamic Spectrum Access Networks;A4
