"sigla_evento";"nome_evento";"estrato"
ICWI;International Conference on WWW/Internet;B4
ICWMC-IARIA;IARIA International Conference on Wireless and Mobile Communications;B4
ICWNWC;International Conference on Wireless Networks;B1
ICWS;IEEE International Conference on Web Services;A3
ICWSM;International AAAI Conference on Web and Social Media;A1
IDC;International Symposium on Intelligent Distributed Computing;B2
IDCS;International Conference on Internet and Distributed Computing Systems;B2
IDEAL;International Conference on Intelligent Data Engineering and Automated Learning;B2
IDEAS;International Database Engineering and Applications Symposium;A4
IEAAIE;International Conference on Industrial Engineering & Other Applications of Appled Intelligence Systems;B2
IECON;Annual Conference of the IEEE Industrial Electronics Society;A2
IEEE eScience;IEEE International eScience Conference;B1
IEEE IST;IEEE International Conference on Imaging Systems and Techniques;B1
IEEE NANO;IEEE Conference on Nanotechnology;B2
IEEE S&P;IEEE Symposium on Security and Privacy;A1
IEEECLOUD;IEEE International Conference on Cloud Computing;A2
IEEEIA;IEEE Symposium on Intelligent Agents;B3
IEEEICCC;IEEE International Conference on Cognitive Computing;A4
IEEEISWC;IEEE International Symposium on Wearable Computers;A3
IEEENANO;International Conference on Nanotechnology;B2
IEEESCC;IEEE International Conference on Services Computing;A4
IEMSS;International Congress on Environmental Modelling & Software;B4
IESS;IFIP International Embedded Systems Symposium;B3
IFAC;World Congress of the International Federation of Automatic Control;A2
IFIPISC;IFIP International Information Security Conference;A4
IFM;International Conference on Integrated Formal Methods;A3
IFSA;World Congress of International Fuzzy Systems Association;B3
IFUZZY;International Conference on Fuzzy Theory and its Applications;B3
IGARSS;IEEE International Geoscience and Remote Sensing Symposium;A3
IGIC;IEEE International Games Innovation Conference;B3
IGSC;International Green and Sustainable Computing Conference;B2
IH&MMSec;ACM Workshop on Information Hiding and Multimedia Security;A4
IHC;Simpósio Brasileiro sobre Fatores Humanos em Sistemas Computacionais;A4
IHM;Conférence Francophone sur l’Interaction Homme-Machine;B3
IIH-MSP;International Conference on Intelligent Information Hiding and Multimedia Signal Processing;B2
IIR;Italian Information Retrieval Workshop;B4
IISWC;IEEE International Symposium on Workload Characterization;A3
IIWAS;International Conference on Information Integration and Web-based Applications & Services;B1
IJCAI;International Joint Conference on Artificial Intelligence;A1
IJCAR;International Joint Conference on Automated Reasoning;A3
IJCB;IEEE International Joint Conference on Biometrics;A2
IJCCI;International Joint Conference on Computational Intelligence;B3
IJCNLP;International Joint Conference on Natural Language Processing;A3
IJCNN;IEEE International Joint Conference on Neural Networks;A2
ILA;Interaction Latin America;B4
ILP;International Conference on Inductive Logic Programming;B3
IM;IFIP/IEEE International Symposium on Integrated Network Management;A2
IMC;ACM Internet Measurement Conference;A1
IMCL;International Conference on Interactive Mobile Communication, Technologies and Learning;B2
IMCOM;International Conference on Ubiquitous Information Management and Communication;A4
IMIS;International Conference on Innovative Mobile and Internet Services in Ubiquitous Computing;A3
IMOC;SBMO/IEEE MTT-S International Microwave and Optoelectronics Conference;B4
IMS3TW;Annual International Mixed-Signals, Sensors and Systems Test Workshop;B4
INCOS;International Conference on Intelligent Networking and Collaborative Systems;A3
INDIN;IEEE International Conference on Industrial Informatics;A3
INDOCRYPT;International Conference on Cryptology in India;A4
INDUSCON;International Conference on Industry Applications;B3
INFOCOM;IEEE International Conference on Computer Communications;A1
InfoVis;IEEE Information Visualization;B3
INLG;International Natural Language Generation conference;B2
INOC;International Network Optimization Conference;B3
INTECH;International Conference on Innovative Computing Technology;B1
INTED;International Technology, Education and Development Conference;B2
INTELLI-IARIA;IARIA International Conference on Intelligent Systems and Applications;B4
INTELLISYS;SAI Intelligent Systems Conference;B1
INTERACCION;International Conference on Human Computer Interaction;B2
INTERACT;IFIP TC 13 International Conference on Human-Computer Interaction;A3
INTERSPEECH;Conference of the International Speech Communication Association;A1
IOLTS;IEEE International On-Line Testing Symposium;B2
IoTAAL;Workshop on Internet of Things for Ambient Assisted Living;B4
IoTBDS;International Conference on Internet of Things and Big Data and Security;B2
IOTCC;International Conference on Internet of things, Data and Cloud Computing;B2
IPAW;International Provenance and Annotation Workshop;B2
IPCCC;International Performance, Computing, and Communications Conference;B1
IPCO;Conference on Integer Programming and Combinatorial Optimization;A3
IPCVWC;International Conference on Image Processing, Computer Vision, and Pattern Recognition;B3
IPDLN;International Population Data Linkage Network;B4
IPDPS;IEEE International Parallel & Distributed Processing Symposium;A1
IPDPSW;IEEE International Parallel & Distributed Processing Symposium Workshops;A4
IPEC;International Symposium on Parameterized and Exact Computation;B1
IPMU;International Conference on Information Processing and Management of Uncertainty in Knowledge-Based Systems;B2
IPPR;INTERNATIONAL CONFERENCE ON IMAGE PROCESSING AND PATTERN RECOGNITION;B3
IPSN;International Conference on Information Processing in Sensor Networks;A2
IPTA;International Conference on Image Processing Theory Tools and Applications;B1
IRI;IEEE International Conference on Information Reuse and Integration;A4
IRIS;IEEE International Symposium on Robotics and Intelligent Sensors;B3
IRMMW;International Conference on Infrared, Millimeter, and Terahertz Waves;A4
IROS;IEEE/RSJ International Conference on Intelligent Robots and Systems;A1
ISAAC;International Symposium Algorithms and Computation;A3
ISADS;International Symposium on Autonomous Decentralized Systems;B1
ISAM;IEEE International Symposium on Assembly and Manufacturing;B3
ISAmI;International Symposium on Ambient Intelligence;B3
ISAP;International Conference on Intelligent System Applications to Power Systems;B3
ISBI;IEEE International Symposium on Biomedical Imaging;A2
ISBRA;International Symposium on Bioinformatics Research and Applications;A4
ISC;International Supercomputing Conference;A3
ISC;International Conference on Information Security;A4
ISC2;IEEE International Smart Cities Conference;B1
ISCA;International Symposium on Computer Architecture;A1
ISCAS;IEEE International Symposium on Circuits and Systems;A2
ISCC;International Symposium on Computers and Communications;A3
ISCE;IEEE International Symposium on Consumer Electronics;B1
ISCIS;International Symposium on Computer and Information Sciences;A3
ISCOPT;International Symposium on Combinatorial Optimization;B2
ISCRAM;International Conference on Information Systems for Crisis Response and Management;A3
ISDA;International Conference on Intelligent Systems Design and Applications;B2
ISDEVEL;International Conference on Information Systems Development;B3
ISEA;International Symposium on Electronic Arts;B4
ISECON;Information Systems Education Conference;B4
ISER;International Symposium on Experimental Robotics;A3
ISEUD;UD - International Symposium on End-User Development;B4
ISGT;IEEE PES Innovative Smart Grid Technologies;A3
ISGT-Europe;IEEE PES Innovative Smart Grid Technologies Conference Europe;A4
ISGTEUROPE;Europe - IEEE International Conference on Innovative Smart Grid Technologies;B2
ISI;IEEE International Conference on Intelligence and Security Informatics;B1
ISIC;International Symposium on Integrated Circuits;B2
ISIE;IEEE International Symposium on Industrial Electronics;A4
ISIS;International Conference on Information Security;A4
ISIT;International Symposium on Information Theory;A1
ISLPED;International Symposium on Low Power Electronics and Design;A3
ISM;IEEE International Symposium on Multimedia;A3
ISMAR;International Symposium on Mixed and Augmented Reality;A3
ISMB/ECCB;Intelligent Systems for Molecular Biology / European Conference on Computational Biology;B3
ISMCR;International Symposium on Measurement and Control in Robotics;B4
ISMIR;International Society for Music Information Retrieval Conference;A2
ISMIS;International Symposium on Methodologies for Intelligent Systems;B3
ISMM;International Symposium on Mathematical Morphology;A4
ISMR;International Symposium on Medical Robotics;B4
ISMVL;IEEE International Symposium on Multiple-Valued Logic;B1
ISNN;International Symposium on Neural Networks;B2
ISOLA;International Symposium on Leveraging Applications of Formal Methods, Verification and Validation;A4
ISORC;IEEE International Symposium on RealTime Distributed Computing;A3
ISPA;IEEE International Symposium on Parallel and Distributed Processing with Applications;B2
ISPASS;IEEE International Symposium on Performance Analysis of Systems and Software;A3
ISPD;ACM International Symposium on Physical Design;A3
ISPDC;International Symposium on Parallel and Distributed Computing;B2
ISQED;International Symposium on Quality Electronic Design;A4
ISR;IEEE International Conference on Intelligence and Safety for Robotics;B4
ISS;ACM International Conference on Interactive Surfaces and Spaces;B3
ISSA;Information Security for South Africa;B2
ISSCC;IEEE International Solid-State Circuits Conference;A1
ISSI;International Society of Scientometrics and Informetrics Conference;B1
ISSPIT;IEEE International Symposium on Signal Processing and Information Technology;B2
ISSRE;IEEE International Symposium on Software Reliability Engineering;A3
ISSREW;IEEE International Symposium on Software Reliability Engineering Workshops;B1
ISSTA;International Symposium on Software Testing and Analysis;A2
ISTAR;International i*Workshop;B4
ISVC;International Symposium on Visual Computing;A3
ISVLSI;IEEE Computer Society Annual Symposium on VLSI;A3
ISW;Information Security Conference;A4
ISWC;International Semantic Web Conference;A1
ISWCS;International Symposium on Wireless Communication Systems;A3
ISWPC;International Symposium on Wireless and Pervasive Computing;B3
ITA;International Conference on Internet Technologies and Applications;B4
ITC;International Test Conference;A4
ITCS;Conference on Innovations in Theoretical Computer Science;A2
ITHET;International Conference on Information Technology Based Higher Education and Training;B2
ITICSE;Conference on Innovation and Technology in Computer Science Education;A3
ITNG;International Conference on Information Technology : New Generations;A4
ITP;International Conference on Interactive Theorem Proving;A3
ITS;International Conference on Intelligent Tutoring Systems;A3
ITSC;IEEE International Conference on Intelligent Transportation Systems;A2
ITSS;Interactive Tabletops and Surfaces;A4
IUI;International Conference on Intelligent User Interfaces;A2
IV;International Conference on Information Visualization;A4
IVA;International Conference on Intelligent Virtual Agents;A3
IVAPP;International Conference on Information Visualization Theory and Applications;B3
IVCNZ;International Conference Image and Vision Computing New Zealand;B2
IVS;Intelligent Vehicles Symposium;A1
IWANN;International Work-Conference on Artificial and Natural Neural Networks;B1
IWBBIO;International Work-Conference on Bioinformatics and Biomedical Engineering;A4
IWBF;International Workshop on Biometrics and Forensics;B1
IWCMC;International Wireless Communications and Mobile Computing Conference;A2
IWCS;International Workshop on Computational Semantics;A3
IWCTS;International Workshop on Computational Transportation Science;B2
IWOCA;International Workshop on Combinatorial Algorithms;B2
IWPSE;International Workshop on Principles of Software Evolution;B3
IWQoS;IEEE/ACM International Symposium on Quality of Service;A4
IWS;Iberchip Workshop;B4
IWSECO;International Workshop on Software Ecosystems;B2
IWSG;International Workshop on Science Gateways;B3
IWSSIP;International Conference on Systems, Signals and Image Processing;B1
IWT;International Workshop on Telecommunications;B3
JCDL;ACM/IEEE Joint Conference on Digital Libraries;A3
JCSC;JOINT INTERNATIONAL CONFERENCE ON SERIOUS GAMES;B3
JCSSE;International Joint Conference on Computer Science and Software Engineering;B1
JURIX;International Conference on Legal Knowledge and Information Systems;B2
KDD;ACM SIGKDD Conference on Knowledge Discovery and Data Mining;A1
KDIR;International Conference on Knowledge Discovery and Information Retrieval;B2
KDMILE;Symposium on Knowledge Discovery, Mining and Learning;B3
KES;International Conference on Knowledge-Based and Intelligent Information & Engineering Systems;B4
KESAMSTA;MSTA - International KES Conference on Agents and Multi-Agent Systems: Technologies and Applications;B2
KESW;International Conference on Knowledge Engineering and Semantic Web;B1
KMO;International Conference on Knowledge Management in Organizations;B3
KnowLOD;Workshop on Knowledge Discovery and Data Mining Meets Linked Open Data;B4
KR;International Conference on Principles of Knowledge Representation and Reasoning;A3
L@S;ACM Conference on Learning @ Scale;B2
LA-CCI;CI - Latin American Conference on Computational Intelligence;B4
LA-WEB;Latin American Web Congress;B4
LAC;Linux Audio Conference;B2
LACLO;Latin American Conference on Learning Objects and Technologies;B2
LADC;Latin-American Symposium on Dependable Computing;B2
LAGOS;Latin-American Algorithms, Graphs and Optimization Symposium;B3
LAK;International Learning Analytics and Knowledge Conference;A2
LANC;Latin American Networking Conference;B4
LANMAN;IEEE International Symposium on Local and Metropolitan Area Networks;B2
LANOMS;Latin-American Network Operations and Management Symposium;B4
LARS;IEEE Latin American Robotics Symposium;B1
LARS/SBR;Simpósio Brasileiro de Robótica;B1
LASCAS;IEEE Latin American Symposium on Circuits and Systems;B1
LATIN;Latin American Symposium on Theoretical Informatics;A4
LATINCLOUD;IEEE Latin America Conference on Cloud Computing and Communications;B4
LATINCOM;IEEE Latin-American Conference on Communications;B2
LATINCRYPT;International Conference on Cryptology and Information Security in Latin America;B1
LATS;IEEE Latin American Test Symposium;B2
LATW;Latin American Test Workshop;B2
LAW;Linguistic Annotation Workshop;B1
LAWCG;Latin American Workshop on Cliques in Graphs;B4
LAWCN;Latin-American Workshop on Computational Neuroscience;B4
LCDNET;Workshop on Lowest Cost Denominator Networking for Universal Access;B4
LCN;IEEE Conference on Local Computer Networks;A4
LCTES;ACM SIGPLAN/SIGBED Conference on Languages, Compilers, and Tools for Embedded Systems;B4
LCTRTS;ACM SIGPLAN/SIGBED Conference on Languages, Compilers, and Tools for Real-Time Systems;B4
LDAV;IEEE Symposium on Large Data Analysis and Visualization;B1
LFCS;Symposium on Logical Foundations of Computer Science;B2
LICS;IEEE Symposium on Logic in Computer Science;A3
LIDTA;Workshop on Learning with Imbalanced Domains: Theory and Applications;B4
LINKDEM;Workshop on Linked Democracy : Artificial Intelligence for Democratic Innovation;B4
LION;Learning and Intelligent Optimization Conference;A4
LISS;International Conference on Logistics, Informatics and Services Sciences;B4
LocalRec;International Workshop on Location-Based Recommendations, Geosocial Networks and Geoadvertising;B4
LocWeb;International Workshop on Location and the Web;B3
LoPaS;Location Privacy and Security Workshop;B4
LPAR;International Conference on Logic for Programming, Artificial Intelligence and Reasoning;A3
LPNMR;International Conference on Logic Programming and Non-monotonic Reasoning;A3
LREC;International Conference on Language Resources and Evaluation;A1
LSFA;Workshop on Logical and Semantic Frameworks, with Applications;B4
LTEC;International Workshop on Learning Technology for Education Challenges;B4
M4IOT;Workshop on Middleware for Context-Aware Applications in the IoT;B3
MABS;International Workshop on Multi-Agent Based Simulation;B2
MANSDNNFV;International Workshop on Management of SDN and NFV Systems;B4
MARMI;International Workshop on Multimedia Analysis and Retrieval for Multimodal Interaction;B4
MASCOTS;International Symposium on the Modeling, Analysis, and Simulation of Computer and Telecommunication Systems;A4
MASLE;Workshop in Multiagent System Based Learning Environments;B4
MASS;Mobility Analytics from Spatial and Social Data;B4
MATES;German Conference on Multiagent System Technologies;B2
Matheuristics;International Workshop on Model-based metaheuristics;B4
MCDM;International Conference on Multiple Criteria Decision Making;B4
MCM;International Conference on Mathematics and Computation in Music;B2
MCPR2;Mexican Conference on Pattern Recognition;B2
MCS;International Workshop on Multiple Classifier Systems Multiple Classifier Systems;B2
MCSoC;International Symposium on Embedded Multicore/Many-core Systems-on-Chip;B3
NetSoftW;IEEE NetSoft Conference and Workshops;A4
MDAI;International Conference on Modeling Decisions for Artificial Intelligence;B3
MDM;IEEE International Conference on Mobile Data Management;A3
MED;Mediterranean Conference on Control and Automation;A4
MEDES;International Conference on Management of Emergent Digital EcoSystems;B2
MEDHOCNET;Mediterranean Ad Hoc Networking Workshop;B2
MEDIAN;Workshop On Manufacturable and Dependable Multicore Architectures at Nanoscale;B4
MEDINFO;World Congress on Medical and Health Informatics;A3
MEMEA;IEEE International Symposium on Medical Measurements and Applications;A4
MESA;IEEE/ASME International Conference on Mechatronic and Embedded Systems and Applications;B4
MetaSel;International Workshop on Meta-Learning and Algorithm Selection;B4
MFCS;International Symposium on Mathematical Foundations of Computer Science;A3
MFI;IEEE International Conference on Multisensor Fusion and Integration for Intelligent Systems;B1
MIC;Metaheuristics International Conference;B3
MICAI;Mexican International Conference on Artificial Intelligence;B1
MICCAI;International Conference on Medical Image Computing and Computer Assisted Intervention;A1
MICRO;IEEE/ACM International Symposium on Microarchitecture;A1
MIDDLEWARE;International Middleware Conference;A3
MIE;Medical Informatics Europe;A3
MIG;ACM Siggraph Conference on Motion in Games;A4
MIKON;International Conference on Microwave, Radar and Wireless Communications;B3
MISE;Workshop on Modeling in Software Engineering;B2
MLDM;International Conference on Machine Learning and Data Mining in Pattern Recognition;B2
MLSP;IEEE International Workshop on Machine Learning for Signal Processing;A4
MMAR;International Conference on Methods and Models in Automation and Robotics;A4
MMEDIA-IARIA;International Conferences on Advances in Multimedia;B4
MMM;International Conference on Multimedia Modelling;A3
MMRP;International Workshop on Multilayer Music Representation and Processing;B3
MMSP;International Workshop on Multimedia and Signal Processing;A4
MMSYS;ACM Multimedia Systems Conference;A2
MobiArch;Workshop on Mobility in the Evolving Internet Architecture;B1
MOBICOM;ACM/IEEE International Conference on Mobile Computing and Networking;A1
MOBIHOC;ACM International Symposium on Mobile Ad Hoc Networking and Computing;A2
MOBILECLOUD;International Conference on Mobile Cloud, Computing and Service Engineering;A4
MOBILEHCI;International Conference on Human-Computer Interaction with Mobile Devices and Services Adjunct;A2
MOBILESOFT;International Conference on Mobile Software Engineering and Systems;A4
MOBILWARE;International Conference on MOBILe Wireless MiddleWARE, Operating Systems, and Applications;B3
MOBIQUITOUS;International Conference on Mobile and Ubiquitous Systems: Computing, Networking and Services;B1
MobiSys;Annual International Conference on Mobile Systems, Applications, and Services;A1
MOBIWAC;ACM International Symposium on Mobility Management and Wireless Access;B2
MODELS;International Conference on Model Driven Engineering Languages and Systems;A3
MODELSWARD;International Conference on Model-Driven Engineering and Software Development;B1
MODULARITY;International Conference on Modularity;B1
MoMM;International Conference on Advances in Mobile Computing & Multimedia;B2
MoWNeT;International Conference on Selected Topics in Mobile and Wireless Networking;B3
MPPU;Models and Paradigms for Planning under Uncertainty: a Broad Perspective Workshop;B4
MRS;International Symposium on Multi-Robot and Multi-Agent Systems;B3
MS;IEEE International Conference on Mobile Services;B1
MSEC;International Manufacturing Science and Engineering Conference;A4
MSI;International Conference on Modelling, Simulation and Identification;B4
MSN;International Conference on Mobile Ad-Hoc and Sensor Networks;B1
MSR;Working Conference on Mining Software Repositories;A1
MSST;IEEE Symposium on Mass Storage Systems and Technologies;A3
MSVWC;International Conference on Modeling, Simulation and Visualization Methods;B3
MSWIM;ACM International Conference on Modeling, Analysis and Simulation of Wireless and Mobile Systems;A4
MTD;International Workshop on Managing Technical Debt;A4
MTSR;International Conference on Metadata and Semantics Research;B2
MUCS;IEEE Workshop on Managing Ubiquitous Communications and Services;B4
MULTITEMP;International Workshop on the Analysis of Multitemporal Remote Sensing Images;B4
MUM;International Conference on Mobile and Ubiquitous Multimedia;A4
MVA;IAPR International Conference on Machine Vision Applications;B1
MWE;Workshop on Multiword Expressions;B3
MWSCAS;International Midwest Symposium on Circuits and Systems;B1
NAACL;North American Chapter of the Association for Computational Linguistics Annual Meeting;A1
NABIC;World Congress on Nature and Biologically Inspired Computing;B2
NAFIPS;Annual Conference of the North American Fuzzy Information Processing Society;B3
NCA;IEEE International Symposium on Network Computing and Applications;B1
NDSS;Network and Distributed System Security Symposium;A1
NESY@HLAI;Workshop on Neural-Symbolic Learning and Reasoning;B4
NETSOFT;IEEE Conference on Network Softwarization;A3
NetSys;International Conference on Networked Systems;B1
NETWORKING;IFIP Networking Conference;A2
NETWORKS;International Telecommunications Network Strategy and Planning Symposium;B1
NeurIPS;Neural Information Processing Systems;A1
NEW2AN;International Conference on Internet of Things, Smart Spaces, and Next Generation Networks and Systems;B4
NEWCAS;IEEE International New Circuits and Systems Conference;B1
NFmcp;International Workshop on New Frontiers in Mining Complex Patterns;B2
NFV-SDN;IEEE Conference on Network Function Virtualization and Software Defined Networks;B1
NIME;International Conference on New Interfaces for Musical Expression;A3
NLDB;International Conference on Application of Natural Language to Information Systems;B1
NLPCS;International Workshop on Natural Language Processing and Cognitive Science;B4
NMR;International Workshop on Non-Monotonic Reasoning;B3
NOC;European Conference on Networks and Optical Communications;B2
NOCS;ACM/IEEE International Symposium on Networks-on-Chip;A3
NOF;International Conference on Network of the Future;B2
NOMS;IEEE/IFIP Network Operations and Management Symposium;A3
NORCAS;Nordic Circuits and Systems Conference;B3
NordiCHI;Nordic Conference on Human-Computer Interaction;A4
NSDI;Networked Systems Design and Implementation;A1
NSS;Network and System Security;A4
NTMS;IFIP International Conference on New Technologies, Mobility and Security;B2
NWPT;Nordic Workshop on Programming Theory;B4
OCEAN;IEEE Oceans Conference;A4
OFC;IEEE Optical Fiber Communication Conference;A1
OM;International Workshop on Ontology Matching;A4
ONDM;International Conference on Optical Network Design and Modeling;A4
ONTOBRAS;Brazilian Seminar on Ontologies;B3
OOPSLA;Conference on Object-Oriented Programming Systems, Languages, and Applications;A2
OpenSym;International Symposium on Open Collaboration;B1
OPODIS;International Conference on Principles of Distributed Systems;A4
OR;International Conference on Operations Research;B3
OSDI;USENIX Symposium on Operating Systems Design and Implementation;A1
OSS;International Conference on Open Source Systems;B2
OzCHI;Australian Conference on Human-Computer Interaction;A3
P2P;International Conference on Peer-to-Peer Computing;B2
PAAMS;International Conference on Practical Applications of Agents, Multi-Agent Systems and Sustainability;A4
PACBB;International Conference on Practical Applications of Computational Biology & Bioinformatics;A4
PacificVis;IEEE Pacific Visualization Symposium;A3
PACIS;Pacific Asia Conference on Information Systems;A3
PACT;International Conference on Parallel Computing Technologies;B1
PACTT;International Conference on Parallel Architectures and Compilation Techniques;A2
PADS;ACM SIGSIM Conference on Principles of Advanced Discrete Simulation;B1
PAKDD;Pacific-Asia Conference on Knowledge Discovery and Data Mining;A3
PAM;Passive and Active Network Measurement Conference;A2
ParCO;International Conference on Parallel Computing;B1
PATAT;International Conference on the Practice and Theory of Automated Timetabling;B4
PATMOS;International Workshop on Power and Timing Modeling, Optimization and Simulation;B2
PATTERNS;International Conferences on Pervasive Patterns and Applications;B4
PCS;Picture Coding Symposium;A4
PDC;Participatory Design Conference;A4
PDCAT;International Conference on Parallel and Distributed Computing, Applications and Technologies;B2
PDES;IFAC International Conference on Programmable Devices and Embedded Systems;B4
PDP;Euromicro International Conference on Parallel, Distributed and Network-Based Processing;A3
